<?xml version="1.0"?>
<Catalog xmlns:xsi="http://www.w3.org/2001/XMLSchema-instance" xsi:noNamespaceSchemaLocation="driverarchivemanifest.xsd" CreateDate="2024-06-14T08:28:35.6299977Z" Version="A00" ReleaseID="PVCKV_X03-00" Application="ManiFestFile From CAB" ApplicationVersion="1.0">
  <System SystemID="0C69" LOB="XPS Notebook" Model="XPS-13-9345">
    <OS Name="Windows11" Arch="arm64" MajorVersion="10" MinorVersion="0" Type="win11">
      <Release ReleaseID="CTKXD_A00-00" ReleaseType="Driver" Category="security" DeviceDescription="Goodix Fingerprint Sensor Driver" DellVersion="A00" VendorVersion="4.10.5.330">
        <Package DestPath="XPS-13-9345\Win11\arm64\security\CTKXD_A00-00\22621\Drivers\Goodix_PID631C\GoodixMocEngineAdapter.dll" SrcPath="XPS-13-9345\Win11\arm64\security\CTKXD_A00-00\22621\Drivers\Goodix_PID631C\GoodixMocEngineAdapter.dll" />
        <Package DestPath="XPS-13-9345\Win11\arm64\security\CTKXD_A00-00\22621\Drivers\Goodix_PID631C\GoodixMocEngineAdapterNw.dll" SrcPath="XPS-13-9345\Win11\arm64\security\CTKXD_A00-00\22621\Drivers\Goodix_PID631C\GoodixMocEngineAdapterNw.dll" />
        <Package DestPath="XPS-13-9345\Win11\arm64\security\CTKXD_A00-00\22621\Drivers\Goodix_PID631C\GoodixMocSensorAdapter.dll" SrcPath="XPS-13-9345\Win11\arm64\security\CTKXD_A00-00\22621\Drivers\Goodix_PID631C\GoodixMocSensorAdapter.dll" />
        <Package DestPath="XPS-13-9345\Win11\arm64\security\CTKXD_A00-00\22621\Drivers\Goodix_PID631C\GoodixMocSensorAdapterNw.dll" SrcPath="XPS-13-9345\Win11\arm64\security\CTKXD_A00-00\22621\Drivers\Goodix_PID631C\GoodixMocSensorAdapterNw.dll" />
        <Package DestPath="XPS-13-9345\Win11\arm64\security\CTKXD_A00-00\22621\Drivers\Goodix_PID631C\GoodixMocStorageAdapter.dll" SrcPath="XPS-13-9345\Win11\arm64\security\CTKXD_A00-00\22621\Drivers\Goodix_PID631C\GoodixMocStorageAdapter.dll" />
        <Package DestPath="XPS-13-9345\Win11\arm64\security\CTKXD_A00-00\22621\Drivers\Goodix_PID631C\GoodixMocStorageAdapterNw.dll" SrcPath="XPS-13-9345\Win11\arm64\security\CTKXD_A00-00\22621\Drivers\Goodix_PID631C\GoodixMocStorageAdapterNw.dll" />
        <Package DestPath="XPS-13-9345\Win11\arm64\security\CTKXD_A00-00\22621\Drivers\Goodix_PID631C\GoodixMocUsb.cat" SrcPath="XPS-13-9345\Win11\arm64\security\CTKXD_A00-00\22621\Drivers\Goodix_PID631C\GoodixMocUsb.cat" />
        <Package DestPath="XPS-13-9345\Win11\arm64\security\CTKXD_A00-00\22621\Drivers\Goodix_PID631C\GoodixMocUsb.inf" SrcPath="XPS-13-9345\Win11\arm64\security\CTKXD_A00-00\22621\Drivers\Goodix_PID631C\GoodixMocUsb.inf" />
        <Package DestPath="XPS-13-9345\Win11\arm64\security\CTKXD_A00-00\22621\Drivers\Goodix_PID631C\GoodixMocWbdi.dll" SrcPath="XPS-13-9345\Win11\arm64\security\CTKXD_A00-00\22621\Drivers\Goodix_PID631C\GoodixMocWbdi.dll" />
        <Package DestPath="XPS-13-9345\Win11\arm64\security\CTKXD_A00-00\22621\Drivers\Goodix_PID631C\GoodixSessionService.exe" SrcPath="XPS-13-9345\Win11\arm64\security\CTKXD_A00-00\22621\Drivers\Goodix_PID631C\GoodixSessionService.exe" />
        <Package DestPath="XPS-13-9345\Win11\arm64\security\CTKXD_A00-00\22621\Drivers\Goodix_PID633C\GoodixMocEngineAdapter.dll" SrcPath="XPS-13-9345\Win11\arm64\security\CTKXD_A00-00\22621\Drivers\Goodix_PID633C\GoodixMocEngineAdapter.dll" />
        <Package DestPath="XPS-13-9345\Win11\arm64\security\CTKXD_A00-00\22621\Drivers\Goodix_PID633C\GoodixMocEngineAdapterNw.dll" SrcPath="XPS-13-9345\Win11\arm64\security\CTKXD_A00-00\22621\Drivers\Goodix_PID633C\GoodixMocEngineAdapterNw.dll" />
        <Package DestPath="XPS-13-9345\Win11\arm64\security\CTKXD_A00-00\22621\Drivers\Goodix_PID633C\GoodixMocSensorAdapter.dll" SrcPath="XPS-13-9345\Win11\arm64\security\CTKXD_A00-00\22621\Drivers\Goodix_PID633C\GoodixMocSensorAdapter.dll" />
        <Package DestPath="XPS-13-9345\Win11\arm64\security\CTKXD_A00-00\22621\Drivers\Goodix_PID633C\GoodixMocSensorAdapterNw.dll" SrcPath="XPS-13-9345\Win11\arm64\security\CTKXD_A00-00\22621\Drivers\Goodix_PID633C\GoodixMocSensorAdapterNw.dll" />
        <Package DestPath="XPS-13-9345\Win11\arm64\security\CTKXD_A00-00\22621\Drivers\Goodix_PID633C\GoodixMocStorageAdapter.dll" SrcPath="XPS-13-9345\Win11\arm64\security\CTKXD_A00-00\22621\Drivers\Goodix_PID633C\GoodixMocStorageAdapter.dll" />
        <Package DestPath="XPS-13-9345\Win11\arm64\security\CTKXD_A00-00\22621\Drivers\Goodix_PID633C\GoodixMocStorageAdapterNw.dll" SrcPath="XPS-13-9345\Win11\arm64\security\CTKXD_A00-00\22621\Drivers\Goodix_PID633C\GoodixMocStorageAdapterNw.dll" />
        <Package DestPath="XPS-13-9345\Win11\arm64\security\CTKXD_A00-00\22621\Drivers\Goodix_PID633C\GoodixMocUsb.cat" SrcPath="XPS-13-9345\Win11\arm64\security\CTKXD_A00-00\22621\Drivers\Goodix_PID633C\GoodixMocUsb.cat" />
        <Package DestPath="XPS-13-9345\Win11\arm64\security\CTKXD_A00-00\22621\Drivers\Goodix_PID633C\GoodixMocUsb.inf" SrcPath="XPS-13-9345\Win11\arm64\security\CTKXD_A00-00\22621\Drivers\Goodix_PID633C\GoodixMocUsb.inf" />
        <Package DestPath="XPS-13-9345\Win11\arm64\security\CTKXD_A00-00\22621\Drivers\Goodix_PID633C\GoodixMocWbdi.dll" SrcPath="XPS-13-9345\Win11\arm64\security\CTKXD_A00-00\22621\Drivers\Goodix_PID633C\GoodixMocWbdi.dll" />
        <Package DestPath="XPS-13-9345\Win11\arm64\security\CTKXD_A00-00\22621\Drivers\Goodix_PID633C\GoodixSessionService.exe" SrcPath="XPS-13-9345\Win11\arm64\security\CTKXD_A00-00\22621\Drivers\Goodix_PID633C\GoodixSessionService.exe" />
      </Release>
      <Release ReleaseID="NPCT8_A00-00" ReleaseType="Driver" Category="audio" DeviceDescription="Qualcomm Audio Driver" DellVersion="A02" VendorVersion="1.0.4019.5861">
        <Package DestPath="XPS-13-9345\Win11\arm64\audio\NPCT8_A00-00\Gmute\BIOSIntf.dll" SrcPath="XPS-13-9345\Win11\arm64\audio\NPCT8_A00-00\Gmute\BIOSIntf.dll" />
        <Package DestPath="XPS-13-9345\Win11\arm64\audio\NPCT8_A00-00\Gmute\dellgmuteext.cat" SrcPath="XPS-13-9345\Win11\arm64\audio\NPCT8_A00-00\Gmute\dellgmuteext.cat" />
        <Package DestPath="XPS-13-9345\Win11\arm64\audio\NPCT8_A00-00\Gmute\DellGMuteExt.inf" SrcPath="XPS-13-9345\Win11\arm64\audio\NPCT8_A00-00\Gmute\DellGMuteExt.inf" />
        <Package DestPath="XPS-13-9345\Win11\arm64\audio\NPCT8_A00-00\Gmute\DellGMuteSupp.dll" SrcPath="XPS-13-9345\Win11\arm64\audio\NPCT8_A00-00\Gmute\DellGMuteSupp.dll" />
        <Package DestPath="XPS-13-9345\Win11\arm64\audio\NPCT8_A00-00\Gmute\DellGMuteSvc.exe" SrcPath="XPS-13-9345\Win11\arm64\audio\NPCT8_A00-00\Gmute\DellGMuteSvc.exe" />
        <Package DestPath="XPS-13-9345\Win11\arm64\audio\NPCT8_A00-00\Gmute\DellGMuteSvc.exe.config" SrcPath="XPS-13-9345\Win11\arm64\audio\NPCT8_A00-00\Gmute\DellGMuteSvc.exe.config" />
        <Package DestPath="XPS-13-9345\Win11\arm64\audio\NPCT8_A00-00\Gmute\dellgmutesw.cat" SrcPath="XPS-13-9345\Win11\arm64\audio\NPCT8_A00-00\Gmute\dellgmutesw.cat" />
        <Package DestPath="XPS-13-9345\Win11\arm64\audio\NPCT8_A00-00\Gmute\DellGMuteSw.inf" SrcPath="XPS-13-9345\Win11\arm64\audio\NPCT8_A00-00\Gmute\DellGMuteSw.inf" />
        <Package DestPath="XPS-13-9345\Win11\arm64\audio\NPCT8_A00-00\qcacsp_crd8380\acdb_cal_FG.acdb" SrcPath="XPS-13-9345\Win11\arm64\audio\NPCT8_A00-00\qcacsp_crd8380\acdb_cal_FG.acdb" />
        <Package DestPath="XPS-13-9345\Win11\arm64\audio\NPCT8_A00-00\qcacsp_crd8380\acdb_cal_Veco.acdb" SrcPath="XPS-13-9345\Win11\arm64\audio\NPCT8_A00-00\qcacsp_crd8380\acdb_cal_Veco.acdb" />
        <Package DestPath="XPS-13-9345\Win11\arm64\audio\NPCT8_A00-00\qcacsp_crd8380\ADCMResources.bin" SrcPath="XPS-13-9345\Win11\arm64\audio\NPCT8_A00-00\qcacsp_crd8380\ADCMResources.bin" />
        <Package DestPath="XPS-13-9345\Win11\arm64\audio\NPCT8_A00-00\qcacsp_crd8380\fai__2.9.0_1.0__3.0.0_0.0__3.1.2_0.0__3.2.0_0.1__eai_2.25.pmd" SrcPath="XPS-13-9345\Win11\arm64\audio\NPCT8_A00-00\qcacsp_crd8380\fai__2.9.0_1.0__3.0.0_0.0__3.1.2_0.0__3.2.0_0.1__eai_2.25.pmd" />
        <Package DestPath="XPS-13-9345\Win11\arm64\audio\NPCT8_A00-00\qcacsp_crd8380\fai__2.9.4_0.0__3.0.0_0.0__3.1.2_0.0__3.2.0_0.1__eai_2.25.pmd" SrcPath="XPS-13-9345\Win11\arm64\audio\NPCT8_A00-00\qcacsp_crd8380\fai__2.9.4_0.0__3.0.0_0.0__3.1.2_0.0__3.2.0_0.1__eai_2.25.pmd" />
        <Package DestPath="XPS-13-9345\Win11\arm64\audio\NPCT8_A00-00\qcacsp_crd8380\fai__3.0.0_0.0__eai_2.10_enpuv3.pmd" SrcPath="XPS-13-9345\Win11\arm64\audio\NPCT8_A00-00\qcacsp_crd8380\fai__3.0.0_0.0__eai_2.10_enpuv3.pmd" />
        <Package DestPath="XPS-13-9345\Win11\arm64\audio\NPCT8_A00-00\qcacsp_crd8380\fai__4.8.4_0.0__3.0.0_0.0__3.1.2_0.0__3.2.0_0.1__eai_2.25.pmd" SrcPath="XPS-13-9345\Win11\arm64\audio\NPCT8_A00-00\qcacsp_crd8380\fai__4.8.4_0.0__3.0.0_0.0__3.1.2_0.0__3.2.0_0.1__eai_2.25.pmd" />
        <Package DestPath="XPS-13-9345\Win11\arm64\audio\NPCT8_A00-00\qcacsp_crd8380\fai__4.8.5_1.0__3.0.0_0.0__3.1.2_0.0__3.2.0_0.1__eai_2.25.pmd" SrcPath="XPS-13-9345\Win11\arm64\audio\NPCT8_A00-00\qcacsp_crd8380\fai__4.8.5_1.0__3.0.0_0.0__3.1.2_0.0__3.2.0_0.1__eai_2.25.pmd" />
        <Package DestPath="XPS-13-9345\Win11\arm64\audio\NPCT8_A00-00\qcacsp_crd8380\ffv__5.0.1_0.1__eai_2.21_enpu3.pmd" SrcPath="XPS-13-9345\Win11\arm64\audio\NPCT8_A00-00\qcacsp_crd8380\ffv__5.0.1_0.1__eai_2.21_enpu3.pmd" />
        <Package DestPath="XPS-13-9345\Win11\arm64\audio\NPCT8_A00-00\qcacsp_crd8380\qcacsp8380.cat" SrcPath="XPS-13-9345\Win11\arm64\audio\NPCT8_A00-00\qcacsp_crd8380\qcacsp8380.cat" />
        <Package DestPath="XPS-13-9345\Win11\arm64\audio\NPCT8_A00-00\qcacsp_crd8380\qcacsp_crd8380.inf" SrcPath="XPS-13-9345\Win11\arm64\audio\NPCT8_A00-00\qcacsp_crd8380\qcacsp_crd8380.inf" />
        <Package DestPath="XPS-13-9345\Win11\arm64\audio\NPCT8_A00-00\qcacsp_crd8380\workspaceFile_FG.qwsp" SrcPath="XPS-13-9345\Win11\arm64\audio\NPCT8_A00-00\qcacsp_crd8380\workspaceFile_FG.qwsp" />
        <Package DestPath="XPS-13-9345\Win11\arm64\audio\NPCT8_A00-00\qcacsp_crd8380\workspaceFile_Veco.qwsp" SrcPath="XPS-13-9345\Win11\arm64\audio\NPCT8_A00-00\qcacsp_crd8380\workspaceFile_Veco.qwsp" />